{"$schema":"https://json-schema.org/draft/2020-12/schema","title":"AWA Module Manifest v0.1","description":"","type":"object","required":["contract","module","requires","provides","authority","visibility","compatibility","provenance_ref"],"properties":{"contract":{"const":"module-manifest.v0.1"},"module":{"type":"object","required":["id","version","type","namespace"],"properties":{"id":{"type":"string","minLength":1},"version":{"type":"string","pattern":"^v\\d+\\.\\d+$"},"type":{"type":"string","enum":["content","rule","platform","visibility","capability","presentation"]},"namespace":{"type":"string","minLength":1}},"additionalProperties":false},"requires":{"type":"object","required":["core","modules","capabilities","semantic_entities"],"properties":{"core":{"type":"array","items":{"type":"string","minLength":1},"uniqueItems":true},"modules":{"type":"array","items":{"type":"string","minLength":1},"uniqueItems":true},"capabilities":{"type":"array","items":{"type":"string","minLength":1},"uniqueItems":true},"semantic_entities":{"type":"array","items":{"type":"string","minLength":1},"uniqueItems":true}},"additionalProperties":false},"provides":{"type":"object","required":["actions","events","rules","assets","projections"],"properties":{"actions":{"type":"array","items":{"type":"string","minLength":1},"uniqueItems":true},"events":{"type":"array","items":{"type":"string","minLength":1},"uniqueItems":true},"rules":{"type":"array","items":{"type":"string","minLength":1},"uniqueItems":true},"assets":{"type":"array","items":{"type":"string","minLength":1},"uniqueItems":true},"projections":{"type":"array","items":{"type":"string","minLength":1},"uniqueItems":true}},"additionalProperties":false},"authority":{"type":"array","items":{"type":"string","minLength":1},"uniqueItems":true},"visibility":{"type":"array","items":{"type":"string","minLength":1},"uniqueItems":true},"compatibility":{"type":"object","required":["class","conflicts"],"properties":{"class":{"type":"string","enum":["C0","C1","C2","C3","C4"]},"conflicts":{"type":"array","items":{"type":"string","minLength":1},"uniqueItems":true}},"additionalProperties":false},"provenance_ref":{"type":"string","minLength":1}},"additionalProperties":false,"$id":"urn:awa:schema:module-manifest-v0-1"}
