{
  "contract":"module-manifest.v0.1",
  "module":{"id":"relay_station.maintenance","version":"v0.1","type":"rule","namespace":"game.relay_station"},
  "requires":{"core":["world.core.v0.1"],"modules":["relay_station.facility_core"],"capabilities":[],"semantic_entities":["role.relay_runner"]},
  "provides":{"actions":["inspect","repair","activate"],"events":["facility.inspected","relay.repaired","relay.activated"],"rules":["maintenance.sequence"],"assets":[],"projections":[]},
  "authority":["runtime.world"],"visibility":["world"],"compatibility":{"class":"C2","conflicts":[]},
  "provenance_ref":"prov:module:relay_station.maintenance:v0.1"
}
