{
  "contract": "module-manifest.v0.1",
  "module": {"id": "alien_lineage.multiworld_rift", "version": "v0.1", "type": "content", "namespace": "game.alien_lineage"},
  "requires": {"core": ["world.core.v0.1"], "modules": ["alien_lineage.species_core"], "capabilities": [], "semantic_entities": []},
  "provides": {"actions": ["enter_rift"], "events": ["rift.entered", "world.changed"], "rules": [], "assets": [], "projections": []},
  "authority": ["runtime.world"],
  "visibility": ["world"],
  "compatibility": {"class": "C1", "conflicts": []},
  "provenance_ref": "prov:module:alien_lineage.multiworld_rift:v0.1"
}
